question,para_question1,para_question2,answers
When was Nitte Mahalinga Adyantaya Memorial Institute of Technology (NMAMIT) established?,When was Nitte Mahalinga Adyantaya Memorial Institute of Technology founded?,What was the date of establishment of Nitte Mahalinga Adyantaya Memorial Institute of Technology (NMAMIT)?,"NMAMIT was established in 1986.For more information, visit https://nmamit.nitte.edu.in/about-nmamit-nitte.php"
Is NMAMIT recognized by any regulatory body?,Are there any regulatory bodies that recognize NMAMIT?,Does NMAMIT get recognized by any regulatory body?,"Yes, NMAMIT is recognized by the All India Council for Technical Education (AICTE), New Delhi. For more information, visit https://nmamit.nitte.edu.in/about-nmamit-nitte.php"
What is NMAMIT's rank in the National Institutional Ranking Framework (NIRF) 2023?,What rank does NMAMIT have in the National Institutional Ranking Framework (NIRF) 2023?,How well does NMAMIT do in the National Institutional Ranking Framework (NIRF) 2023?,"NMAMIT is ranked in the rank band of 101-150 in NIRF 2023 by the Ministry of Education, Government of India. For more information, visit https://nmamit.nitte.edu.in/about-nmamit-nitte.php"
Which university is NMAMIT affiliated with?,What university does NMAMIT belong to?,With which university is NMAMIT associated?,"NMAMIT is a constituent college of Nitte (Deemed to be University), Mangaluru.For more information, visit https://nmamit.nitte.edu.in/about-nmamit-nitte.php"
What are the undergraduate (UG) engineering programs offered by NMAMIT?,What are the undergraduate engineering courses offered by NMAMIT?,Which engineering courses are offered by NMAM Institute of Technology (NMAMIT) for the B.Tech program?,"The UG engineering programs offered are: Artificial Intelligence & Machine Learning, Artificial Intelligence & Data Science, Biotechnology, Civil Engineering, Computer & Communication Engineering, Computer Science & Engineering, Computer Science (Cyber Security), Computer Science (Full Stack Development), Electrical & Electronics Engineering, Electronics & Communication Engineering, Electronics (VLSI Design & Technology), Electronics & Communication Engineering (ACT), Information Science & Engineering, Mechanical Engineering, and Robotics & Artificial Intelligence.For more information, visit https://nmamit.nitte.edu.in/about-nmamit-nitte.php"
What are the engineering course available for the M.Tech. program at NMAM Institute of Technology (NMAMIT)?,What are the graduate engineering courses offered by NMAMIT?,Which engineering courses are offered by NMAM Institute of Technology (NMAMIT) for the M.Tech program?,"The seven disciplines for M.Tech. program are Construction Technology, Computer Science & Engineering, Cyber Security, Electric Vehicle Technology, Machine Design, Structural Engineering, and VLSI Design & Embedded Systems.For more information, visit https://nmamit.nitte.edu.in/about-nmamit-nitte.php"
Does NMAMIT have provisions for research work leading to Ph.D and how does it promote research among its students.?,"How does NMAMIT encourage research that leads to a PhD, and how does it encourage research among its students?","How does NMAMIT promote research among its students, and does it have provisions for research leading to a PhD?","Yes, all the departments at NMAMIT have qualified research guides for students interested in taking up research work leading to Ph.D. and it promotes research among its students by providing qualified research guides, facilities, and opportunities for collaborative projects.For more information, visit https://nmamit.nitte.edu.in/about-nmamit-nitte.php"
What is the total area of NMAMIT's campus?,What is the entire size of the campus of NMAMIT?,How large is the area of NMAMIT's campus?,"NMAMIT's campus is spread over 125 acres.For more information, visit https://nmamit.nitte.edu.in/about-nmamit-nitte.php"
What is the nearest airport and railway stations to NMAMIT?,Which airports and railway stations are closest to NMAMIT?,What are the closest train and airport terminals to NMAMIT?,"The nearest airport to NMAMIT is Mangaluru International Airport, which is 45 km away and the nearest railway stations to NMAMIT are Udupi (40 km) and Mangaluru (50 km).For more information, visit https://nmamit.nitte.edu.in/about-nmamit-nitte.php"
Which highways are closest to NMAMIT?,Which roads are near NMAMIT?,Are there any highways closest to NMAMIT?,"The highways closest to NMAMIT are the ones connecting Karkala and Padubidri, as Nitte is situated between these two towns.For more information, visit https://www.google.co.in/maps/place/N.M.A.M.+Institute+of+Technology/@13.1830012,74.9316861,17.25z/data=!3m1!5s0x3bbcaa27e8fd79af:0x343962e5369a908a!4m6!3m5!1s0x3bbb56415ad85e5b:0x10b77ac6f6afc7fa!8m2!3d13.1830026!4d74.933989!16zL20vMDQxa25k?entry=ttu"
Are there any international collaborations for NMAMIT?,Do any international collaborations exist for NMAMIT?,Does NMAMIT have any overseas partnerships?,"Yes, NMAMIT has active collaborations with several international universities and organizations for faculty and student exchanges, research, internships, and placements.For more information, visit https://nmamit.nitte.edu.in/about-nmamit-nitte.php"
What is the significance of NBA accreditation for UG programs at NMAMIT?,Why is it important for NMAMIT to have NBA accreditation for its undergraduate programs?,What does the NBA accreditation mean for NMAMIT's undergraduate programs?,"NBA accreditation signifies the quality and standards of the UG programs at NMAMIT, ensuring they meet the set benchmarks.For more information, visit https://nmamit.nitte.edu.in/about-nmamit-nitte.php"
Are there any specific provisions for industry exposure at NMAMIT?,Does NMAMIT offer any special provisions for exposure to the industry?,Are there any specific provisions in place for industry exposure at NMAMIT?,"Yes, NMAMIT has high industry linkages and collaborations, providing students with ample opportunities for industry exposure through internships, projects, and placements.For more information, visit https://nmamit.nitte.edu.in/about-nmamit-nitte.php"
Are there any provisions for co-curricular activities at NMAMIT?,Does NMAMIT offer any special provisions for exposure to the co-curricular activities ?,Are there any specific provisions in place for co-curricular activities  at NMAMIT?,"Yes, NMAMIT encourages co-curricular activities through clubs, societies, and events, fostering holistic development among students.For more information, visit https://nmamit.nitte.edu.in/about-nmamit-nitte.php"
What measures does NMAMIT take to ensure quality education?,What steps does NMAMIT take to guarantee high-quality instruction?,What does NMAMIT do to make sure its students get good education?,"NMAMIT ensures quality education through experienced faculty, modern infrastructure, industry collaborations, and accreditation processes.For more information, visit https://nmamit.nitte.edu.in/about-nmamit-nitte.php"
How does NMAMIT support student entrepreneurship?,What does NMAMIT do to support student entrepreneurship?,What are the ways in which NMAMIT supports student entrepreneurship?,"NMAMIT supports student entrepreneurship through incubation centers, mentorship programs, and industry tie-ups to nurture innovative ideas and startups.For more information, visit https://nmamit.nitte.edu.in/about-nmamit-nitte.php"
What distinguishes NMAMIT from other engineering colleges?,What are the differences between NMAMIT and other engineering colleges?,How is NMAMIT different from other engineering colleges?,"NMAMIT stands out due to its industry linkages, research opportunities, vibrant campus, and emphasis on holistic development.For more information, visit https://nmamit.nitte.edu.in/about-nmamit-nitte.php"
What is the role of NMAMIT's faculty in fostering student growth and ensure academic excellence?,How can NMAMIT's faculty help students grow?,How can the teachers at NMAMIT support the development of its students?,"NMAMIT's faculty play a crucial role in mentoring, guiding, and inspiring students to excel academically and professionally and ensures academic excellence through rigorous curriculum, continuous assessment, faculty development programs, and academic support services.For more information, visit https://nmamit.nitte.edu.in/about-nmamit-nitte.php"
How does NMAMIT ensure student welfare on campus?,In what manner does NMAMIT ensure the welfare of students within its premises?,How is the wellbeing of students on campus ensured by NMAMIT?,"NMAMIT ensures student welfare through counseling services, student support centers, and a conducive learning environment.For more information, visit https://nmamit.nitte.edu.in/about-nmamit-nitte.php"
How does NMAMIT contribute to regional development?,In what ways does NMAMIT support regional development?,What is the role of NMAMIT in regional development?,"NMAMIT contributes to regional development by providing skilled manpower, conducting research, and collaborating with local industries and communities.For more information, visit https://nmamit.nitte.edu.in/about-nmamit-nitte.php"
What facilities does NMAMIT provide for sports and recreation?,What sports facilities does NMAMIT have?,Which facilities does NMAMIT have for sports and recreation?,"NMAMIT provides sports facilities, recreational spaces, and organizes events to promote physical fitness and extracurricular activities among students.For more information, visit https://nmamit.nitte.edu.in/about-nmamit-nitte.php"
How does NMAMIT promote innovation among its students?,How does NMAMIT encourage students to innovate?,How does NMAMIT encourage creativity among its students?,"NMAMIT promotes innovation through hackathons, innovation labs, project competitions, and mentorship programs to nurture creativity and problem-solving skills.For more information, visit https://nmamit.nitte.edu.in/about-nmamit-nitte.php"
What role does NMAMIT play in sustainable development?,How important is NMAMIT to sustainable development?,What is the significance of NMAMIT in the realm of sustainable development?,"NMAMIT promotes sustainable practices through initiatives such as green campus initiatives, waste management programs, and awareness campaigns.For more information, visit https://nmamit.nitte.edu.in/about-nmamit-nitte.php"
How does NMAMIT ensure gender diversity on campus?,How does NMAMIT make sure there is gender diversity on campus?,What measures does NMAMIT take to ensure gender diversity on campus?,"NMAMIT encourages gender diversity through awareness programs, scholarships, and inclusive policies to create a supportive environment for all students.For more information, visit https://nmamit.nitte.edu.in/about-nmamit-nitte.php"
What support does NMAMIT provide for career development?,How does NMAMIT help career development?,Does NMAMIT provide career development support?,"NMAMIT offers career counseling, skill development programs, placement assistance, and industry interactions to enhance students' employability.For more information, visit https://nmamit.nitte.edu.in/about-nmamit-nitte.php"
How does NMAMIT engage with the local community?,What is NMAMITs approach to engaging with the local community?,In what ways does NMAMIT interact with its community?,"NMAMIT engages with the local community through outreach programs, social initiatives, and collaborative projects to address societal needs and contribute to development.For more information, visit https://nmamit.nitte.edu.in/about-nmamit-nitte.php"
What initiatives does NMAMIT take for student leadership development?,What does NMAMIT do to develop student leaders?,What steps does NMAMIT take to foster the development of student leaders?,"NMAMIT offers leadership training, student council activities, and opportunities for participation in clubs and organizations to foster leadership skills among students.For more information, visit https://nmamit.nitte.edu.in/about-nmamit-nitte.php"
"What is NMAM Institute of Technology's mission, vision and their core values?",What are the goals and objectives of NMAM Institute of Technology?,Which goals and objectives does NMAM Institute of Technology have?,"NMAM Institute of Technology aims to pursue excellence, empower people, and partner in community development and mission of NMAM Institute of Technology is to develop as a Center of Excellence by imparting quality education to generate competent, skilled, and humane manpower capable of facing emerging scientific, technological, managerial, and social challenges with credibility, integrity, ethics, and social concern.NMAM Institute of Technology values ethics, teamwork, honesty, loyalty, and both professional and personal integrity.For more information, visit https://nmamit.nitte.edu.in/vision-mission.php"
who is the founder of nitte?,Who founded NITTE?,Who established NITTE?,"LATE JUSTICE K. S HEGDE. For more information, visit https://nmamit.nitte.edu.in/founder.php"
who is the Principal of NMAMIT and what is his email address?,What is the name of the principal of NMAMIT and his email address?,What is the NMAMIT Principal's email address and who is he?,"Prof. Niranjan N Chiplunkar,his email is principal_nmamit@nitte.edu.in. For more information, visit https://nmamit.nitte.edu.in/principal.php"
who is the Vice principal & Dean of NMAMIT and what is his email address?,"What is the email address of the Vice Principal and Dean of NMAMIT, and who is he?",May I know the name and email address of the Vice Principal of NMAMIT?,"Dr. I. Ramesh Mithanthaya, his email is viceprincipal.nmamit@nitte.edu.in. For more information, visit https://nmamit.nitte.edu.in/vice-principal.php"
who is the Vice Principal & Controller of Examinations of NMAMIT?,What is the name of the NMAMIT Vice Principal and Exam Controller?,May I know the name of the Vice Principal and controller of examinations of NMAMIT?,"Dr. Shrinivasa Rao B.R.For more information, visit https://nmamit.nitte.edu.in/vice-principal.php"