question,para_question1,para_question2,answer
What is Mr. Manjunath Maiya's current position?,What position does Mr. Manjunath Maiya currently hold?,What is Mr. Manjunath Maiya's current role?,Assistant Professor Gd-II in Mechanical Department
What is Mr. Manjunath Maiya's departmental responsibility?,What are Mr. Manjunath Maiya's responsibilities within his department?,What are Mr. Manjunath Maiya's roles within his department?,Time Table Coordinator
What subjects does Mr. Manjunath Maiya handle?,Which subjects does Mr. Manjunath Maiya teach or handle?,What topics does Mr. Manjunath Maiya dealt with?,"Elements of Mechanical Engineering, Manufacturing Process I, Manufacturing Process II, Statistical Quality Control, Metrology & Measurements, Operations Research, Introduction to Aircraft Design, Power Plant Engineering"
What is Mr. Gautama Hebbar A.'s highest educational qualification?,What is the highest educational qualification of Mr. Gautama Hebbar A.?,What is Mr. Gautama Hebbar A.'s highest level of education?,"M. Tech Nuclear Engineering from Manipal Institute of Technology, Manipal University, 2014"
What was Mr. Gautama Hebbar A.'s major during his B.E.?,What was Mr. Gautama Hebbar A.'s major during his B.E. studies?,What was Mr. Gautama Hebbar A.'s specialization during his B.E.?,Mechanical
What was Mr. Gautama Hebbar A.'s past experience?,What is Mr. Gautama Hebbar A.'s previous work experience?,What has been Mr. Gautama Hebbar A.'s professional journey?,"Assistant Professor at Moodlakatte Institute of Technology, Kundapura from Sep 2012 to Jul 2013"
What are Mr. Gautama Hebbar A.'s departmental responsibilities?,What are Mr. Gautama Hebbar A.'s departmental responsibilities?,What are Mr. Gautama Hebbar A.'s roles within his department?,"Co-ordinator for Association for interaction of Mechanical students (AIMS), Coordinator for IQAC"
What subjects does Mr. Gautama Hebbar A. handle?,Which subjects does Mr. Gautama Hebbar A. teach or handle?,What topics does Mr. Gautama Hebbar A. dealt with?,"Basic and applied thermodynamics, Employability and skill development, Fluid mechanics, Elements of mechanical engineering, Introduction to aircraft design, Design of machine elements II, Mechanical vibrations, Manufacturing Process, Heat Transfer, Material science and metallurgy"
What is Mr. Bhaskar P's highest educational qualification?,What is the highest educational qualification of Mr. Bhaskar P.?,What is Mr. Bhaskar P's highest level of education?,"PhD  Pursuing at NITK, Surathkal, M.Tech in Production Engineering Systems Technology (PEST) from National Institute of Engineering, Mysore in 2014, B.E. in Industrial & Production Engineering from U.B.D.T.C.E. Davangere in 2009"
What was Mr. Bhaskar P's major during his M.Tech?,What was Mr. Bhaskar P.'s major during his M.Tech studies?,What was Mr. Bhaskar P's specialization during his M.Tech?,Production Engineering Systems Technology (PEST)
What was Mr. Bhaskar P's past experience?,What is Mr. Bhaskar P.'s previous work experience?,What has been Mr. Bhaskar P's professional journey?,"Working as Assistant Professor Gd-II in the Dept. of Mechanical Engg. NMAMIT, Held responsibilities as coordinator of Project work, Technical seminar, Time table committee and co-curricular events, Worked as a Project Trainee for Nine Months under Quality Management & Methods Dept. in Diesel Systems, Bosch Ltd., Bengaluru-30."
What are Mr. Bhaskar P's departmental responsibilities?,What are Mr. Bhaskar P.'s departmental responsibilities?,What are Mr. Bhaskar P's roles within his department?,"Time Table Preparation, UG Project work, Coordinator"
What subjects does Mr. Bhaskar P handle?,Which subjects does Mr. Bhaskar P. teach or handle?,What topics does Mr. Bhaskar P dealt with?,"Materials Science & Engineering, Manufacturing Processes, Operations Research, Statistical Quality Control, Non-Destructive Testing, Metrology & Measurements, Foundry Technology, Work study and Ergonomics, and Engineering fundamentals courses"
What is Mr. Mohan Poojari's highest educational qualification?,What is the highest educational qualification of Mr. Mohan Poojari?,What is Mr. Mohan Poojari's highest level of education?,"Ph.D (Pursuing), M.Tech Machine Design from VVIT, Bangalore"
What was Mr. Mohan Poojari's past experience?,What is Mr. Mohan Poojari's previous work experience?,What has been Mr. Mohan Poojari's professional journey?,"Industry for 7 years (Forbes Marchall, Pune), Assistant Professor Gd-II at NMAM Institute of Technology, Nitte from 2014"
What are Mr. Mohan Poojari's departmental responsibilities?,What are Mr. Mohan Poojari's departmental responsibilities?,What are Mr. Mohan Poojari's roles within his department?,"Staff Coordinator SAE Baja (ATV), Mechanical Department Library In charge, Industry Institute Collaboration - Department Coordinator, TCS-Techbytes - Department Coordinator"
What subjects does Mr. Mohan Poojari handle?,Which subjects does Mr. Mohan Poojari teach or handle?,What topics does Mr. Mohan Poojari dealt with?,"Metrology & Measurements, Internal Combustion Engines, Introduction to Aircraft Design, Heat Transfer, Operations Management & Entrepreneurship, Elements of Mechanical Engineering, Mineral Processing"
What is Mr. Sunil Kumar Shetty's highest educational qualification?,What is the highest educational qualification of Mr. Sunil Kumar Shetty?,What is Mr. Sunil Kumar Shetty's highest level of education?,"Ph.D (Pursuing), M.Tech in Computer Aided Mechanical Design and Analysis (CAMDA) from Manipal Institute of Technology in 2014, B.E. in INDUSTRIAL & PRODUCTION Engineering from N.M.A.M. Institute of Technology, Nitte in 2004"
What was Mr. Sunil Kumar Shetty's past experience?,What is Mr. Sunil Kumar Shetty's previous work experience?,What has been Mr. Sunil Kumar Shetty's professional journey?,"Industry for 8 years (Muscat Overseas LLC-Muscat Oman as Senior Engineer for 3.5 years, Technofit LLC Muscat Oman as Senior Engineer for 2.5 years, PeekaySteel, Coimbatore, India for 2 years), Teaching for 5 years"
What are Mr. Sunil Kumar Shetty's departmental responsibilities?,What are Mr. Sunil Kumar Shetty's departmental responsibilities?,What are Mr. Sunil Kumar Shetty's roles within his department?,"Coordinator for Welding & Piping Design, Staff Coordinator of Indian Welding Society"
What subjects does Mr. Sunil Kumar Shetty handle?,Which subjects does Mr. Sunil Kumar Shetty teach or handle?,What topics does Mr. Sunil Kumar Shetty dealt with?,"Vibration, Mechatronics, Robotics, Fluid Machinery"
What is Mr. Raghavendra Pai K.'s highest educational qualification?,What is the highest educational qualification of Mr. Raghavendra Pai K.?,What is Mr. Raghavendra Pai K.'s highest level of education?,"PhD  pursuing at NITK, Surathkal, Masters in Machine Design from NMAMIT, Nitte, BE in Mechanical Engineering from MIT-Kundapura."
What are Mr. Raghavendra Pai K.'s departmental responsibilities?,What are Mr. Raghavendra Pai K.'s departmental responsibilities?,What are Mr. Raghavendra Pai K.'s roles within his department?,FPSI Coordinator
What subjects does Mr. Raghavendra Pai K. handle?,Which subjects does Mr. Raghavendra Pai K. teach or handle?,What topics does Mr. Raghavendra Pai K. dealt with?,"Industrial Robotics, Dynamics of Machines, Mechatronics, Introduction to aircraft design"
What is Dr. Melwyn Rajesh Castelino's highest educational qualification?,What is the highest educational qualification of Dr. Melwyn Rajesh Castelino?,What is Dr. Melwyn Rajesh Castelino's highest level of education?,"Ph.D, M.Tech - Machine Design - 2014, N.M.A.M. Institute of Technology, Nitte, B.E - Mechanical - 2011, Sahyadri College of Engineering, Mangalore"
What was Dr. Melwyn Rajesh Castelino's past experience?,What is Dr. Melwyn Rajesh Castelino's previous work experience?,What has been Dr. Melwyn Rajesh Castelino's professional journey?,"Faculty in Dept. of Mechanical Engineering, SMVITM, Bantakal, Udupi, from August 2011 to November 2012. Lab Instructor in various Engineering colleges in Mangalore from August 2003 till August 2008."
What are Dr. Melwyn Rajesh Castelino's departmental responsibilities?,What are Dr. Melwyn Rajesh Castelino's departmental responsibilities?,What are Dr. Melwyn Rajesh Castelino's roles within his department?,"Training & Placement coordinator, Product Design Engineering Program Manager, Department Coursera Coordinator"
What subjects does Dr. Melwyn Rajesh Castelino handle?,Which subjects does Dr. Melwyn Rajesh Castelino teach or handle?,What topics does Dr. Melwyn Rajesh Castelino dealt with?,"Strength of Materials, Mechanics of Materials, Computer Aided Machine Drawing, Fluid Mechanics/ Machines Dynamics of Machines, Design of Machine Elements, Computer Aided Engineering Drawing, Mechanical Vibrations, Finite Element Analysis"