questions,para_question1,para_question2,Answer
Can you provide examples of 'Super Dream' companies that placement department students have been selected by?,Could you provide examples of companies where placement department students have been selected?,Can you give examples of 'Super Dream' companies that have selected placement department students?,"placement department may encourage students to prioritize academic excellence while also providing support and guidance to help them effectively manage their time and commitments. For more info, refer to https://nmamit.nitte.edu.in/placement.php."
How does placement department ensure that students maintain a balance between academic excellence and participation in recruitment processes?,In what manner does the placement department ensure that students maintain a balance between academic excellence and active participation in recruitment procedures?,How does placement department ensure students balance academic achievement with involvement in recruitment processes?,"Alumni may offer insights, advice, and networking opportunities to current students, leveraging their own experiences and connections to help facilitate successful career placements. For more info, refer to https://nmamit.nitte.edu.in/placement.php."
What role do alumni play in supporting current students through the recruitment process?,How can alumni help current students during the hiring process?,What part do alumni play in aiding current students through the recruitment process?,"placement department may regularly review and update its recruitment policies and strategies to align with evolving industry trends, ensuring that students remain competitive in the job market. For more info, refer to https://nmamit.nitte.edu.in/placement.php."
How does placement department adapt its recruitment policies and strategies to changing industry trends and demands?,How does the placement department change its ways of hiring people to fit the changing needs of the industry?,How does placement department adjust its recruitment policies and tactics in response to evolving industry trends and needs?,"The highest salary offered to students at NMAM Institute of Technology for the year 2019-20 was 30 lakhs. For more details, visit https://nmamit.nitte.edu.in/placement.php"
What was the highest salary offered to students at NMAM Institute of Technology for the year 2019-23?,"In the academic year 2019Ð2023 at NMAM Institute of Technology, what was the highest package granted to students?",Tell me the highest salary provided to students at NMAM Institute of Technology for the academic year 2019-20.,"For the year 2020-21, the highest salary offered was 24.78 lakhs, which is lower than the previous year's highest salary of 30 lakhs.The highest salary offered for the year 2021-22 was significantly higher than the previous year's highest salary of 24.78 lakhs. The highest salary offered for the year 2022-23 was lower than the previous year's highest salary of 52.63 lakhs. For more details, visit https://nmamit.nitte.edu.in/placement.php"
What is the highest salary offered to students at NMAM Institute of Technology for the year 2024?,"In the academic year 2024 at NMAM Institute of Technology, what was the highest package granted to students?",Tell me the highest salary offered to students at NMAM Institute of Technology for the academic year 2024.,"The highest salary offered for the year 2024 is the same as the highest salary offered in the year 2021-22. For more details, visit https://nmamit.nitte.edu.in/placement.php"
What is the trend in the highest salaries offered to students at NMAM Institute of Technology in recent years?,What has been the pattern in the highest package that NMAM Institute of Technology offered its students more recently?,What is the trend in the highest salaries offered to students at NMAM Institute of Technology in recent years?,"The trend in the highest salaries offered to students at NMAM Institute of Technology has been positive, with a significant increase in the year 2021-22 and a slight decrease in the following year. However, the highest salary offered for the year 2024 is the same as the highest salary offered in the year 2021-22, indicating a stabilization of the trend. For more details, visit https://nmamit.nitte.edu.in/placement.php"