questions,para_question1,para_question2,Answer
What specific strategies are discussed during the workshop to develop a healthy campus atmosphere and promote a positive attitude towards adolescents?,What specific strategies are discussed in the workshop to create a healthy campus atmosphere and promote a positive attitude towards adolescents?,What are the key strategies discussed in the workshop to foster a healthy campus environment and encourage a positive mindset among teenagers?,"Strategies discussed include creating supportive environments, fostering open communication channels, implementing mental health awareness programs, and promoting peer support networks. For more info, refer to https://nmamit.nitte.edu.in/placement.php."
"Can you elaborate on the curriculum of the workshop, particularly the sessions focused on understanding normal and abnormal adolescent behavior?",Can you tell me more about the workshop and how it helps teens understand normal and unusual behavior?,"Can you detail the workshop's curriculum, especially the modules dedicated to comprehending typical and atypical adolescent behaviors?","The curriculum includes sessions on adolescent developmental stages, common behavioral patterns, warning signs of mental health issues, and techniques for differentiation between normal and abnormal behavior. For more info, refer to https://nmamit.nitte.edu.in/placement.php."
Could you provide examples of the basic counseling skills that participants acquire during the workshop?,Could you tell me more about the basic counseling skills that participants learn during the workshop?,What are some of the fundamental counseling techniques that workshop attendees learn?,"Participants learn active listening, empathy, non-verbal communication, problem-solving, and conflict resolution skills to effectively support adolescents in distress. For more info, refer to https://nmamit.nitte.edu.in/placement.php."
How are participants trained to identify individuals in need of support and to refer them promptly?,How are participants trained to identify people who need help and refer them quickly?,How do participants learn to recognize individuals requiring assistance and how to refer them efficiently?,"Participants undergo training on recognizing signs of distress, conducting assessments, and understanding the appropriate referral pathways to mental health professionals or support services. For more info, refer to https://nmamit.nitte.edu.in/placement.php."
"In the sessions addressing psychiatric disturbances in young people, what particular topics or disorders are covered, and how are they addressed with compassion and without stigma?","What topics or disorders are covered in the sessions about psychiatric disorders in young people, and how are they dealt with with compassion and without stigma?","In the workshop segments on psychiatric issues in young individuals, what specific topics or conditions are discussed, and how are they approached with empathy and without discrimination?","Topics may include depression, anxiety, suicidal ideation, self-harm, substance abuse, and eating disorders. These are addressed with empathy, sensitivity, and emphasis on reducing stigma through education and awareness. For more info, refer to https://nmamit.nitte.edu.in/placement.php."
Can you explain how the workshop aims to minimize problems in young people while facilitating their maximum growth?,Can you tell me how the workshop aims to help young people grow?,How does the workshop aim to prevent challenges in young people while enabling their optimal development?,"The workshop focuses on early intervention, building resilience, fostering positive coping mechanisms, and providing support networks to mitigate problems and promote healthy development in adolescents. For more info, refer to https://nmamit.nitte.edu.in/placement.php."
What methodologies or interactive approaches are utilized during the workshop to ensure effective learning and engagement among the participants?,What methods or interactive approaches are used during the workshop to make sure the participants learn and get involved?,What teaching methods or interactive activities are used in the workshop to ensure effective learning and participant engagement?,"Methodologies may include group discussions, case studies, role-playing exercises, interactive presentations, and experiential learning activities to encourage active participation and knowledge retention. For more info, refer to https://nmamit.nitte.edu.in/placement.php."
How are real-life case studies or scenarios incorporated into the workshop to enhance participants' understanding and application of the concepts discussed?,How do we use real-life examples or situations in the workshop to help people understand and use the ideas we talk about?,How are real-world case studies or examples integrated into the workshop to deepen participants' comprehension and application of the discussed concepts?,"Real-life case studies and scenarios are presented to illustrate practical applications of counseling techniques, crisis intervention strategies, and referral processes in various situations involving adolescents. For more info, refer to https://nmamit.nitte.edu.in/placement.php."
"Are there any guest speakers or experts invited to share their insights or experiences during the workshop sessions? If so, what are their areas of expertise?",Are there people who are invited to speak or give advice during the workshops? What are their areas of expertise?,"Are there any special guests or experts invited to share their perspectives or experiences during the workshop sessions? If so, what are their fields of expertise?","Yes, experts in adolescent psychology, counseling, psychiatry, and suicide prevention may be invited to share their knowledge, experiences, and best practices in addressing adolescent mental health issues. For more info, refer to https://nmamit.nitte.edu.in/placement.php."
"Following the workshop, what measures or support systems are in place to ensure that participants can continue applying the knowledge and skills they have acquired in their respective roles or professions?",What measures or support systems are in place to make sure that participants can continue to use the knowledge and skills they have gained after the workshop?,"After the workshop, what support systems or measures are available to help participants apply the knowledge and skills they've gained in their professional roles?","Post-workshop support may include ongoing mentorship, access to resources and referral networks, follow-up training sessions, and opportunities for professional development and networking within the mental health community. For more info, refer to https://nmamit.nitte.edu.in/placement.php."
What is the primary focus of placement department regarding the participation of first-year students in its initiatives?,What does placement department do to get first-year students involved in its initiatives?,What is the main emphasis of placement department on involving first-year students in its activities?,"placement department focuses on ensuring the participation of first-year students in all its initiatives to engage them in meaningful activities besides their academic studies. For more info, refer to https://nmamit.nitte.edu.in/placement.php."
Why is it particularly important for placement department to encourage participation in creative and recreational pursuits among first-year students?, Why is it important for the placement department to encourage first-year students to take part in creative and recreational activities?,Why is it crucial for placement department to promote engagement in artistic and leisure activities among first-year students?,"It is important because most students tend to give up such pursuits during their pre-university days, and placement department aims to reintroduce and promote these activities among them. For more info, refer to https://nmamit.nitte.edu.in/placement.php."
"Can you elaborate on placement department's Primary preventive programme, Mission Prerana for Change, and its objectives?","Can you explain the placement department's Primary preventive programme, Mission Prerana for Change, and its objectives?","Can you explain the main preventive program of placement department, Mission Prerana for Change, and its goals?","Mission Prerana for Change is a value-added program aimed at first-year students in the Physics cycle. It seeks to fulfill placement department's vision by providing a platform for students to engage in meaningful activities and personal growth. For more info, refer to https://nmamit.nitte.edu.in/placement.php."
"How frequently was Mission Prerana for Change held, and what was its duration?",How often did Mission Prerana for Change happen and how long did they last?,"How often was Mission Prerana for Change conducted, and how long did each session last?","Mission Prerana for Change was held every Wednesday afternoon for 150 minutes in the open-air auditorium Sadananda. For more info, refer to https://nmamit.nitte.edu.in/placement.php."
How many students were typically accommodated in each session of Mission Prerana for Change?,How many students did Mission Prerana for Change usually accommodate?,How many students were usually included in each session of Mission Prerana for Change?,"Each session accommodated 500 students at a time, organized into groups of 25 for effective facilitation. For more info, refer to https://nmamit.nitte.edu.in/placement.php."
"Who were the individuals involved in facilitating Mission Prerana for Change, and how were they trained?",Who helped with Mission Prerana for Change and how were they trained?,"Who were the people involved in running Mission Prerana for Change, and how did they receive their training?","Mission Prerana for Change was facilitated by a committed band of Prerana faculty and volunteers who were trained to assist in the planned syllabus for the students. For more info, refer to https://nmamit.nitte.edu.in/placement.php."
"What was the objective of Mission Prerana for Change @ Induction, held in the first fortnight of August 2019?",What was the purpose of Mission Prerana for Change @ Induction in the first fortnight of August 2019?,"What was the aim of Mission Prerana for Change @ Induction, which took place in the first two weeks of August 2019?","The objective was to introduce Mission Prerana for Change to over 1000 first-year students with the active assistance of trained faculty facilitators and first-year teachers. For more info, refer to https://nmamit.nitte.edu.in/placement.php."
"Who designed and executed Mission Prerana for Change @ Induction, and what role did they play?",Who designed and did Mission Prerana for Change @ Induction?,"Who created and implemented Mission Prerana for Change @ Induction, and what was their role?","Professor Shalini K. Sharma designed and executed Mission Prerana for Change @ Induction, presumably taking a leading role in its planning and implementation. For more info, refer to https://nmamit.nitte.edu.in/placement.php."
How was Mission Prerana for Change @ Induction different from the regular Mission Prerana for Change sessions?,What were the distinctions between Mission Prerana for Change @ Induction and regular Mission Prerana sessions?,How did Mission Prerana for Change @ Induction differ from the standard Mission Prerana for Change sessions?,"Mission Prerana for Change @ Induction was a special program designed to introduce the initiative to a larger group of first-year students at the beginning of their academic year, likely with a modified curriculum or focus. For more info, refer to https://nmamit.nitte.edu.in/placement.php."
What impact did Mission Prerana for Change and Mission Prerana for Change @ Induction have on the participating students?,How did Mission Prerana for Change and Mission Prerana @ Induction affect the students who took part?,What effects did Mission Prerana for Change and Mission Prerana for Change @ Induction have on the participants?,"The impact could include improved personal development, engagement in meaningful activities, and potentially enhanced academic performance as a result of holistic education and personal growth initiatives. For more info, refer to https://nmamit.nitte.edu.in/placement.php."
How does the department view students in terms of their role within the academic community?,How does the department see students as part of the academic community?,How does the department perceive students in terms of their contribution to the academic community?,"The department provides opportunities for students to reach out and help others in need, fostering compassion, competence, and leadership skills among them. For more info, refer to https://nmamit.nitte.edu.in/placement.php."
What specific initiatives does the department undertake to promote volunteering among students?,What is the department doing to encourage students to volunteer?,What specific programs does the department implement to encourage student volunteering?,"Students are encouraged to become 'givers' by engaging in avenues for personal growth, working with juniors or peers, providing guidance and assistance, and eventually becoming mentors themselves. For more info, refer to https://nmamit.nitte.edu.in/placement.php."
How do students transition from being 'receivers' to 'givers' through the department's initiatives?,How can students become 'givers' through the department's initiatives?,How do students evolve from being 'beneficiaries' to 'contributors' through the department's programs?,"The department offers opportunities for students to work with juniors, participate in orientation programs, provide peer assistance, undergo structured classes, and participate in guided programs such as 'Crack the Campus.' For more info, refer to https://nmamit.nitte.edu.in/placement.php."
Can you elaborate on the various avenues for personal growth provided to students by the department?,Can you explain how the department helps students grow as individuals?,Can you detail the various pathways for personal development offered to students by the department?,"Pride placement department' aims to orient interested juniors to dynamic programming from their first year onwards, especially those selected by Super Dream companies. For more info, refer to https://nmamit.nitte.edu.in/placement.php."
How have the highest salaries offered to students at NMAM Institute of Technology changed over the years?,How has the highest package offered to students at NMAM Institute of Technology changed over time?,How has the NMAM Institute of Technology's the highest salary for students changed over time?,"It has drastically changed due the current market situations, layoffs in the big tech companies. For more infor please refer https://nmsmit.nitte.edu.in/placement.php"
What is the purpose of the 'Pride placement department' initiative started in 2017?,Why did the 'Pride placement department' start in 2017?,"What is the aim of the 'Pride placement department' initiative, which was launched in 2017?","The department ignites student initiative by helping them structure and run clubs, guiding them to ensure they serve their intended purposes effectively. For more info, refer to https://nmamit.nitte.edu.in/placement.php."
How does the department support the formation and running of various clubs by students?,How can the department help students start and run clubs?,How does the department facilitate the establishment and operation of student clubs?,"Some clubs include Kalanjali (Dance), ClicZ (Photography), Aura & Hands of Hope (Community service), Grey Matter (Quiz), Thorana (Event management), and many others, each serving specific purposes. For more info, refer to https://nmamit.nitte.edu.in/placement.php."
Can you provide examples of some clubs formed under the department's initiatives and their respective purposes?,Are there any examples of clubs that were formed under the department's initiatives and what their goals were?,Can you give examples of clubs established under the department's initiatives and their objectives?,"SACA, run by students, helps peers, juniors, and seniors build confidence by offering soft skills and communication training, playing a significant role in student development. For more info, refer to https://nmamit.nitte.edu.in/placement.php."
What is the role of SACA (Soft Skills & Communication Association) in the department's student support efforts?,What does SACA do for student support?,What is the function of SACA (Soft Skills & Communication Association) in the department's efforts to support students?,"Yuj for Life focuses on improving student well-being by addressing issues such as stress, dysmenorrhea, asthma, and concentration through activities in hostels, sister institutions, and nearby schools. For more info, refer to https://nmamit.nitte.edu.in/placement.php."
"What is the objective of Yuj for Life, founded by Shreesha Govind in 2015?","What is the purpose of Yuj for Life, founded by Shreesha Govind in 2015?","What is the goal of Yuj for Life, established by Shreesha Govind in 2015?","Authorcraft provides students with opportunities to engage in creative writing pursuits on a weekly basis, fostering creativity and meaningful expression. For more info, refer to https://nmamit.nitte.edu.in/placement.php."
"How does Authorcraft, the Creative Writers Club, contribute to student engagement and development?","How does Authorcraft, the Creative Writers Club, help students develop?","How does Authorcraft, the Creative Writers Club, enhance student engagement and personal growth?","The collaboration between the clubs involved in various aspects of filmmaking led to the creation of 'Kalachakra,' showcasing the collective talent and creativity of the students involved. For more info, refer to https://nmamit.nitte.edu.in/placement.php."
What impact do these extracurricular initiatives have on student development and campus culture?,What do these extracurricular activities do for student development and campus culture?,What effects do these extracurricular activities have on student growth and the campus culture?,"The department ensures that these activities are structured to provide students with opportunities for personal and professional development, aligning with their academic goals and enhancing their overall growth. For more info, refer to https://nmamit.nitte.edu.in/placement.php."
How does the department ensure that these extracurricular activities complement students' academic pursuits and overall growth?,What steps does the department take to ensure that these extracurricular activities complement students' academic pursuits and enhance their overall development?,How does the department ensure that these extracurricular activities align with students' academic goals and overall development?,"The department may have plans to expand existing initiatives or introduce new ones to meet the evolving needs and interests of students, fostering continuous growth and engagement. For more info, refer to https://nmamit.nitte.edu.in/placement.php."
Are there any plans to expand or introduce new initiatives in the future to further support student development?,Do you plan to add more or different things in the future to help students grow?,Are there any future plans to introduce or expand initiatives to enhance student development?,"placement department permits only students with very good academic scores to pursue options in 'Dream' or 'Core' companies, particularly those recruiting in large numbers. For more info, refer to https://nmamit.nitte.edu.in/placement.php."
What is the policy followed by placement department regarding students' options after being placed in service-based companies?,What policy does the placement department have about what students can do after they are placed in service-based companies?,What is the approach of placement department towards students' career options after being placed in service-oriented companies?,"The policy is shared with students as they enter the campus as freshmen, allowing them to make informed decisions about their academic performance and career aspirations. For more info, refer to https://nmamit.nitte.edu.in/placement.php."
"How is this policy communicated to students, and when do they become aware of it?",How do students learn about this rule and when do they find out?,"How is this approach communicated to students, and at what point do they learn about it?","Students with a CGPA of 8.25 or above are typically eligible to apply for positions in 'Dream' or 'Core' companies, reflecting a high level of academic proficiency. For more info, refer to https://nmamit.nitte.edu.in/placement.php."
Can you explain the criteria for students to be eligible for options in 'Dream' or 'Core' companies?,Is there a criteria for students to be eligible for options in dream or core companies?,Can you describe the eligibility criteria for students to be considered for 'Dream' or 'Core' company options?,"If a student is selected by a core company, they may choose to forego the previous offer and remain with the core company instead of the dream company. For more info, refer to https://nmamit.nitte.edu.in/placement.php."
What happens if a student with a placement offer from a large recruiter is subsequently selected by a core company?,What happens if a student who got a job offer from a big company gets hired by another company?,What happens if a student receives a job offer from a major recruiter but is later chosen by a core company?,"In 2016, amendments were made to include very prestigious brands as 'Super Dream' companies, providing students with additional opportunities for career advancement. For more info, refer to https://nmamit.nitte.edu.in/placement.php."
What criteria must a student meet to be eligible for consideration by a 'Super Dream' company?,"To be considered by a 'Super Dream' company, what criteria must a student meet?",What requirements must a student fulfill to be considered for opportunities by a 'Super Dream' company?,"Recruiting companies have consistently praised placement department students for their pragmatic, professional, and ethical conduct, contributing to a positive image for the college. For more info, refer to https://nmamit.nitte.edu.in/placement.php."
What feedback have recruiting companies provided about NMAMIT students? ,What have hiring companies said about NMAMIT students?,What insights have recruitment firms shared about NMAMIT students?,"The department adopts a pragmatic, professional, and ethical approach to sustain meaningful, synergistic, and long-standing relationships with these entities, fostering mutual trust and cooperation. For more info, refer to https://nmamit.nitte.edu.in/placement.php."
"How does the department maintain positive relationships with recruiting organizations, well-wishers, and visiting companies?","How does the department keep working well with companies that hire people, people who wish them well, and companies that come to visit?","How does the department foster positive relationships with recruitment agencies, supporters, and visiting companies?","placement department may provide training, workshops, and resources to help students develop necessary skills and competencies required for recruitment processes, ensuring their readiness for employment opportunities. For more info, refer to https://nmamit.nitte.edu.in/placement.php."
What measures does placement department take to ensure that students are well-prepared for recruitment processes?,How does the placement department ensure that students are adequately prepared for the recruitment procedures?,What steps does placement department take to ensure students are adequately prepared for recruitment procedures?,"placement department maintains a transparent and merit-based recruitment process, adhering to ethical standards and providing equal opportunities for all students to pursue their career aspirations. For more info, refer to https://nmamit.nitte.edu.in/placement.php."
How does placement department ensure fairness and transparency in the recruitment process for both students and companies?,How does the placement department make sure that both students and companies are treated fairly and clearly during the hiring process?,How does placement department guarantee equity and openness in the recruitment process for both students and companies?,"placement department may offer career counseling, mentorship programs, and access to resources to help students make informed decisions and maximize their potential for success in the recruitment process. For more info, refer to https://nmamit.nitte.edu.in/placement.php."
What support systems are in place to assist students in navigating the recruitment process and making informed decisions?,What support systems are in place to help students navigate the recruitment process and make informed decisions?,What support mechanisms are available to help students navigate the recruitment process and make informed choices?,"Examples of 'Super Dream' companies may include prestigious brands or organizations known for their exceptional career opportunities and competitive selection processes. For more info, refer to https://nmamit.nitte.edu.in/placement.php."
